{
  "$schema": "https://json-schema.org/draft/2020-12/schema",
  "$id": "https://opentopia.local/evaluation/suite.schema.json",
  "title": "Application evaluation suite",
  "type": "object",
  "required": ["schemaVersion", "id", "title", "tasks"],
  "properties": {
    "schemaVersion": { "const": 1 },
    "id": { "type": "string", "minLength": 1 },
    "title": { "type": "string", "minLength": 1 },
    "description": { "type": "string" },
    "repetitions": { "type": "integer", "minimum": 1, "maximum": 100 },
    "tasks": {
      "type": "array",
      "minItems": 1,
      "uniqueItems": true,
      "items": { "type": "string", "minLength": 1 }
    }
  },
  "additionalProperties": false
}
